id,publisher,scrape_time,text
7624,detroitnews.com,2019-05-31T09:23:02-04:00,FacebookEmail Twitter Google+ LinkedIn Pinterest ### Lawyers: Docs show census changed to give Republicans edge ### A trove of newly discovered documents revealed longtime Republican gerrymandering guru played key role in pushing to include a citizenship question ### Post to Facebook ### Lawyers: Docs show census changed to give Republicans edge   A trove of newly discovered documents revealed longtime Republican gerrymandering guru played key role in pushing to include a citizenship question    Check out this story on detroitnews.com: https://www.detroitnews.com/story/news/politics/2019/05/31/lawyers-docs-show-census-changed-give-republicans-edge/39532181/ ### CancelSend ### A link has been sent to your friend's email address. ### Posted! ### A link has been posted to your Facebook feed. ### Join the Conversation
8200,cbsnews.com,2019-05-31T11:03:26-04:00,"Lawyer claims documents reveal census question added to help Republicans ### May 31, 2019 / 10:50 AM ### / AP ### Debate over 2020 census question ### NEW YORK — A Republican redistricting expert advocated for adding a citizenship question to the 2020 census to give an electoral edge to white people and Republicans, opponents of the move alleged in a court filing Thursday. ### The filing in Manhattan federal court said a trove of newly discovered documents revealed that Thomas Hofeller, a longtime Republican gerrymandering guru, played a key role in pushing the Trump administration to include a citizenship question on the census for the first time since 1950. ### Lawyers for opponents of adding the question said the files, found on Hofeller's computer drives after he died last year, also showed that he contributed vital language to a Justice Department letter used to justify the question on the grounds that it was needed to protect minority voting rights. ### Trending News ### De Blasio Interview ### In reality, the lawyers argued, the documents show the census change is part of a wider Republican effort to restrict the political power of Democrats and Latino communities. ### ""The new evidence reveals that Dr. Thomas Hofeller, the longtime Republican redistricting specialist, played a significant role in orchestrating the addition of the citizenship question to the 2020 Decennial Census in order to create a structural electoral advantage for, in his own words, 'Republicans and Non-Hispanic Whites,' and that defendants obscured his role through affirmative misrepresentations,"" the filing said. ### How gerrymandering became one of the biggest issues in politics ### The Justice Department denied those allegations in a statement released late Thursday, calling them an ""an unfortunate last-ditch effort"" to derail a U.S. Supreme Court decision on the legality of adding the citizenship question. ### The change, announced in spring 2018, seems poised for approval by the court, which heard arguments in April and is likely to rule by July. ### It's not yet clear if the Hofeller documents might affect the case, though the American Civil Liberties Union apprised the high court of the latest developments Thursday in a letter signed by Dale Ho, director of the group's voting rights project and a lawyer who argued against adding the question before the top court. ### States, cities and rights groups had sued in New York and elsewhere, arguing that the question would suppress the count of immigrants and strengthen congressional representation and funding for areas where mostly Republicans reside. States with large numbers of immigrants tend to vote Democratic. ### Lawyers for President Trump's administration say the commerce secretary has wide discretion to design the census questionnaire. ### On Thursday, lawyers for groups including the ACLU said that the files show that a Justice Department official and a transition official for Trump testified falsely by hiding Hofeller's role in asking for the question. They asked U.S. District Judge Jesse M. Furman to issue sanctions or consider finding individuals in contempt. ### Ho, of the ACLU, said documents found after Hofeller's death last year, including a 2015 study that the redistricting expert had done, revealed the administration's ""goal was to dilute the voting power of minority communities. That's literally the diametric opposite of what the administration has been saying all along."" ### Furman gave the Justice Department until Monday to respond and set a hearing in the case for June 5. ### The Justice Department said in its statement that ""these eleventh-hour allegations by the plaintiffs, including an accusation of dishonesty against a senior Department of Justice official, are false."" ### ""That study played no role in the Department's December 2017 request to reinstate a citizenship question to the 2020 decennial census,"" it said. ""The Department looks forward to responding in greater detail to these baseless accusations in its filing on Monday."" ### The Hofeller documents cited by lawyers were discovered when his estranged daughter found four external computer hard drives and 18 thumb drives in her father's Raleigh, North Carolina, home after his death last summer. ### The New York Times reported that she contacted Common Cause, which had recently sued in state court to challenge North Carolina's legislative districts, which had been drawn by Hofeller. ### Furman, the federal judge, ruled in January that the question could not be included on the census, saying fewer people would respond to the census and that the process used to add it was faulty. Federal judges in California and Maryland reached similar conclusions in separate lawsuits. ### Besides the citizenship question, the Supreme Court also is expected to decide within weeks, in cases from North Carolina and Maryland, whether to set limits for the first time on drawing districts for partisan advantage. ### First published on May 31, 2019 / 10:50 AM ### © 2019 The Associated Press. All Rights Reserved. This material may not be published, broadcast, rewritten, or redistributed."
8818,syracuse.com,2019-05-31T09:56:35-04:00,"By The Associated Press ### NEW YORK (AP) — A Republican redistricting expert advocated for adding a citizenship question to the 2020 census to give an electoral edge to white people and Republicans, opponents of the move alleged in a court filing Thursday. ### The filing in Manhattan federal court said a trove of newly discovered documents revealed that Thomas Hofeller, a longtime Republican gerrymandering guru, played a key role in pushing the Trump administration to include a citizenship question on the census for the first time since 1950. ### Lawyers for opponents of adding the question said the files, found on Hofeller's computer drives after he died last year, also showed that he contributed vital language to a Justice Department letter used to justify the question on the grounds that it was needed to protect minority voting rights. ### In reality, the lawyers argued, the documents show the census change is part of a wider Republican effort to restrict the political power of Democrats and Latino communities. ### ""The new evidence reveals that Dr. Thomas Hofeller, the longtime Republican redistricting specialist, played a significant role in orchestrating the addition of the citizenship question to the 2020 Decennial Census in order to create a structural electoral advantage for, in his own words, 'Republicans and Non-Hispanic Whites,' and that defendants obscured his role through affirmative misrepresentations,"" the filing said. ### The Justice Department denied those allegations in a statement released late Thursday, calling them an ""an unfortunate last-ditch effort"" to derail a U.S. Supreme Court decision on the legality of adding the citizenship question. ### The change, announced in spring 2018, seems poised for approval by the court, which heard arguments in April and is likely to rule by July. ### It's not yet clear if the Hofeller documents might affect the case, though the American Civil Liberties Union apprised the high court of the latest developments Thursday in a letter signed by Dale Ho, director of the group's voting rights project and a lawyer who argued against adding the question before the top court. ### States, cities and rights groups had sued in New York and elsewhere, arguing that the question would suppress the count of immigrants and strengthen congressional representation and funding for areas where mostly Republicans reside. States with large numbers of immigrants tend to vote Democratic. ### Lawyers for President Donald Trump's administration say the commerce secretary has wide discretion to design the census questionnaire. ### On Thursday, lawyers for groups including the ACLU said that the files show that a Justice Department official and a transition official for Trump testified falsely by hiding Hofeller's role in asking for the question. They asked U.S. District Judge Jesse M. Furman to issue sanctions or consider finding individuals in contempt. ### Ho, of the ACLU, said documents found after Hofeller's death last year, including a 2015 study that the redistricting expert had done, revealed the administration's ""goal was to dilute the voting power of minority communities. That's literally the diametric opposite of what the administration has been saying all along."" ### Furman gave the Justice Department until Monday to respond and set a hearing in the case for June 5. ### The Justice Department said in its statement that ""these eleventh-hour allegations by the plaintiffs, including an accusation of dishonesty against a senior Department of Justice official, are false."" ### ""That study played no role in the Department's December 2017 request to reinstate a citizenship question to the 2020 decennial census,"" it said. ""The Department looks forward to responding in greater detail to these baseless accusations in its filing on Monday."" ### The Hofeller documents cited by lawyers were discovered when his estranged daughter found four external computer hard drives and 18 thumb drives in her father's Raleigh, North Carolina, home after his death last summer. ### The New York Times reported that she contacted Common Cause, which had recently sued in state court to challenge North Carolina's legislative districts, which had been drawn by Hofeller. ### Furman, the federal judge, ruled in January that the question could not be included on the census, saying fewer people would respond to the census and that the process used to add it was faulty. Federal judges in California and Maryland reached similar conclusions in separate lawsuits. ### Besides the citizenship question, the Supreme Court also is expected to decide within weeks, in cases from North Carolina and Maryland, whether to set limits for the first time on drawing districts for partisan advantage. ### View Comments ### Footer Navigation ### Disclaimer"
8985,washingtonpost.com,2019-05-31T07:50:25-04:00,"Speaker of the House Nancy Pelosi (D-Calif.) (AP Photo/Eric Risberg) ### On The Hill ### For now, congressional Republicans, ardent free-traders that some claim to be, have remained largely silent while on recess from Washington. ### One major opponent already, though, is Sen. Chuck Grassley, the Iowa Republican who leads the powerful Senate Finance Committee. ### “Trade policy and border security are separate issues,” Grassley said in a statement. “This is a misuse of presidential tariff authority and counter to congressional intent. Following through on this threat would seriously jeopardize passage of USMCA, a central campaign pledge of President Trump’s and what could be a big victory for the country.” ### Grassley, you might remember, took to the Wall Street Journal op-ed page to deliver an ultimatum to Trump in April, telling Trump to end his tariffs on Mexican or Canadian steel and aluminum tariffs or watch the USCMA die. Those tariffs were nixed in a deal just two weeks ago. ### Graham defends Trump: Sen. Lindsey Graham (R-S.C.) sided with Trump (surprise!) and defended the tariffs. In turn, Graham, who is running for reelection next year, also became the latest victim of there’s always a tweet: ### Simply put, any policy proposal which drives up costs of Corona, tequila, or margaritas is a big-time bad idea. Mucho Sad. (2) ### — Lindsey Graham (@LindseyGrahamSC) January 26, 2017 ### The worst possible time: The oddest part about Trump’s announcement is that it comes just as Mexico, Canada and the United States are marshaling their respective legislatures to ratify the USMCA. ### Mexico: Earlier Thursday, AMLO  submitted the deal to the Mexican Senate. ### Canada: Vice President Pence was in Canada to meet with Prime Minister Justin Trudeau and sell the accord. Just a day earlier, officials there formally presented the USCMA to the Canadian parliament. Time is running short there as lawmakers are expected to head home June 21 in advance of the country’s national elections this October. ### At home: The Trump administration on Thursday moved to start the clock on when it will formally submit the USCMA to Congress. ### “Pelosi directly cautioned U.S. Trade Representative Robert E. Lighthizer not to send the draft report until Democrats had spent more time working with the White House on the plan. And on Thursday, she attacked the White House’s decision to move ahead,” our colleagues Damian Paletta, Erica Werner and Josh Dawsey report . ### China: Trump is already fighting a trade war with China that shows no signs of progress. The possibility the U.S. and Mexico could soon be at loggerheads. ### President Trump gestures as he poses alongside Britain's Prime Minister Theresa May during the opening ceremony of the NATO (North Atlantic Treaty Organization) summit on July 11, 2018. (Photo by EMMANUEL DUNAND/AFP/Getty Images) ### Global Power ### INSIDE TRUMP’S EUROPE TRIP: Trump’s second visit to the U.K. will be wrapped in royal pomp and circumstance, with some aspects reportedly overseen by Queen Elizabeth II herself. But the trip also comes as the two allies fight over a Chinese telecom giant and British politics are in turmoil over Prime Minister Theresa May’s impending resignation. ### The timing: “The dates for D-Day are pretty fixed,” a senior administration official told reporters on a call previewing the trip. “This is the 75th commemoration . . . the president has said over and over again about the ‘unshakable bond’ between the two countries that even in the most difficult times where you may have political upheaval and uncertainty that you need to stand together shoulder to shoulder.” ### Trump’s shadow: We don't know who will succeed May, but Trump might meet with one of the candidates vying to fill the role, such as former Foreign Secretary Boris Johnson. There’s also the possibility he could seek a tete-a-tete with controversial Brexit Party head Nigel Farage. ### Protests: Trump’s “working visit” to the U.K. last year turned out hundreds of thousands of protesters across London, above whom hovered the infamous Trump balloon. The Evening Standard cited a YouGov poll finding that 54 percent of Londoners oppose Trump’s visit. Protests, including the balloon, are expected again. ### What May and Trump will discuss: ### Huawei: The U.S. is pressuring the U.K. to reject Huawei's involvement in 5G networks after the U.S. government put Huawei on a so-called “trade blacklist” and is warning publicly that allowing the  company access to critical networks runs the risk the Chinese government could one day use the position for surveillance or leverage. ### A U.K. official told Bloomberg’s Margaret Talev and Josh Wingrove that Huawei is indeed on the agenda. ### A trade deal: Brexit has still yet to become a reality, but soon enough the U.K. will be looking to strike its own bilateral trade deal with Trump. CNN’s Ivana Kottasová reported in March the Trump administration’s wish list includes “comprehensive access” for agricultural goods, which translates into allowing “genetically modified crops, animal feed with antibiotics and chlorine-washed chicken products that are banned in the European Union but common in the United States.” ### What it’s like to be in the room: Former French Ambassador to the U.S. Gérard Araud gave a frank interview to Politico’s Nahal Toosi, speaking about what it's like to deal with Trump and just how “special” the U.S.-U.K. relationship remains. “At no moment has the fact of being an ally in anyway prevented Trump from trying to twist the arm of the other side,” Araud said. “The special relationship was more special on the British side than the American side.” ### Some highlights from the schedule: ### June 3: Trump and first lady Melania Trump arrive in London where the queen will host them at Buckingham Palace for an arrival ceremony. They will later travel to Westminster Abbey. The day will conclude with the queen’s state dinner in honor of the president. ### June 4: Trump meets with May and the pair will also meet with American and British business leaders. ### June 5: Trump travels to Portsmouth, the first of two events he is attending to mark the 75th anniversary of D-Day. The president later travels to Ireland for a meeting with Taoiseach Leo Varadkar. ### June 6: Trump travels to Normandy for a D-Day commemoration at an American cemetery. He will also meet with French President Emmanuel Macron on the sidelines. ### Immigration activists rally outside the Supreme Court as the justices hear arguments over the Trump administration's plan to ask about citizenship on the 2020 census, in Washington. (AP Photo/J. Scott Applewhite) ### In the Agencies ### BOMBSHELL DEVELOPMENT IN CENSUS CASE: ""Just weeks before the Supreme Court is expected to rule on whether the Trump administration can add a citizenship question to the 2020 Census, new evidence emerged Thursday suggesting the question was crafted specifically to give an electoral advantage to Republicans and whites,"" our colleagues Tara Bahrampour and Robert Barnes report. ### The new evidence: ""The evidence was found in the files of the prominent Republican redistricting strategist Thomas Hofeller after his death in August. It reveals that Hofeller 'played a significant role in orchestrating the addition of the citizenship question to the 2020 Decennial Census in order to create a structural electoral advantage for, in his own words, 'Republicans and Non-Hispanic Whites,'' plaintiffs’ lawyers challenging the question wrote in a letter Thursday morning to U.S. District Judge Jesse M. Furman,  one of three federal judges  who  ruled against the question  this year."" ### ""The lawyers also argued that Trump administration officials purposely obscured Hofeller’s role in court proceedings."" ### What was on the drives: ""Files on those drives showed that he wrote a study in 2015 concluding that adding a citizenship question to the census would allow Republicans to draft even more extreme gerrymandered maps to stymie Democrats,""  writes the New York Times' Michael Wines , whose reporting included the shocking development. ### ""And months after urging President Trump’s transition team to tack the question onto the census, he wrote the key portion of a draft Justice Department letter claiming the question was needed to enforce the 1965 Voting Rights Act — the rationale the administration later used to justify its decision."" ### From a Mother Jones reporter: ### 🚨🚨New docs show that architect of GOP gerrymandering was behind Trump's push to add citizenship question to 2020 census, said it ""would clearly be a disadvantage to the Democrats” & “advantageous to Republicans and Non-Hispanic ### — Ari Berman (@AriBerman) May 30, 2019 ### In the Media ### What else we're reading:"
9090,nbcnews.com,2019-06-01T00:24:40-04:00,"May 10, 2017, 12:56 AM UTC ### / Source: Associated Press ### WASHINGTON — The director of the people-counting Census Bureau is leaving his job just as the agency steps up its once-a-decade tally, the Commerce Department said Tuesday. ### Census Bureau Director John H.  Thompson said he is pursuing ""opportunities in the private sector.""  ### Census Director John Thompson poses for a portrait in this undated handout image.U.S. Census ### Thompson testified to a House committee last week that the 2020 Census was on track.  The 2010 Census was the costliest U.S.     He spent 30 years in public service and 10 in the private sector.""   ### The U.S. recently surpassed 325 million people. By 2044, whites are expected to become a minority.  ### The director is nominated by the president for a five-year term and confirmed by the Senate."
