id,publisher,scrape_time,text
3581,nbcnews.com,2019-05-31T21:07:27-04:00,"May 31, 2019, 9:52 PM UTC ### By Jessica Levinson, professor at Loyola Law School ### The Supreme Court is about to start looking a lot more like a political branch. Indeed, in a decade or less, we may look back at this time as the era in which the court lost any imprimatur of judicial independence. ### The court’s upcoming decision as to whether the Department of Commerce can add a question about citizenship to our national census will provide us with some important tea leaves for determining whether the current court is becoming the handmaiden of conservative politicians. The court is expected to rule by the end of June. ### New evidence suggests that Secretary of Commerce Wilbur Ross’ decision to add a citizenship question to the census had everything to do with helping Republicans and harming Democrats. These revelations mostly confirm what many observers had long suspected about the true motivations of the Commerce Department. What is more surprising — and revealing — is the fact that none of this is likely to matter to the Supreme Court. ### These revelations mostly confirm what many observers had long suspected. What is more shocking is the fact that none of this is likely to matter to the Supreme Court. ### The legal issues of the case may sound mundane, but the political stakes are huge. The U.S. Constitution says that Congress must count how many people live in our country. The census, conducted by the Department of Commerce, determines the number of representatives in the House, the distribution of electors in the Electoral College, and the amount of federal funding each state gets. While the commerce secretary is in charge of the census, he or she cannot engage in activities that are arbitrary and capricious. And yet, that is just what Secretary Wilbur Ross has done. ### In 2017, Ross disingenuously claimed that the Department of Justice had suggested that the Department of Commerce add a citizenship question to the census to help in enforcing the federal Voting Rights Act. But the idea to add the citizenship question appears not to have originated with the Department of Justice and has nothing to do with enforcing voters' rights. Meanwhile, many experts believe that adding a citizenship question to the census will lead people in immigrant-heavy areas, including legal and illegal immigrants, to not respond. This inaccuracy is why career experts in the Department of Commerce unanimously recommended that the citizenship question not be included. ### Smoking gun evidence of Trump's push to rig the census ### May 31, 201906:37 ### This is not a minor issue. The Census Department itself estimates that as many as 6.5 million people could not be counted as a result of adding the citizenship question. And it is not a coincidence that the majority of these 6.5 million people live in areas dominated by Democrats. In fact, we now know, that is in fact the whole point. ### Recently discovered documents on the computer of now-deceased Republican operative and redistricting expert Thomas Hofeller indicate that the idea to add the citizenship question actually originated with him, not the Department of Justice. His goal was not to help the Department of Justice enforce the Voting Rights Act, but rather to use this information to allow states to draw legislative district lines based not on the total population, but instead on the number of eligible voters. This would, he wrote, help “Republicans and non-Hispanic whites,” and would clearly hurt Democrats. ### The newly unearthed documents do not tell us more than what many already strongly suspected, but they do bring into stark relief why the Trump administration is so determined to add the citizenship question, and how they have lied about it. ### During oral arguments in April , the conservative members of the court appeared ready to accept at face value the Department of Commerce’s assertion that the citizenship question will be added to help enforce the Voting Rights Act. It is worth remembering that the conservative wing of the court has not been particularly concerned about the Voting Rights Act in the past. In fact, just six years ago it struck down a key portion of the act designed to protect voters from discriminatory voting laws. ### Since that 2013 decision, states and localities throughout the nation have enacted laws burdening the right to vote . States have, for instance, reduced or eliminated early voting, reduced the number of voting centers, purged voter rolls, and implemented stringent voter identification requirements. This was an entirely predictable consequence of the court’s decision. ### More recently, a slim conservative majority of the court voted to uphold an Ohio law that took voters off the voter rolls if they failed to both vote in one election and respond to a postcard asking them to confirm their address. The court couched its language in the need to protect the integrity of the electoral process, but the truth is that Ohio’s law disproportionately affects the ability of poor and minority voters to vote. And again, not coincidentally, those people are disproportionately Democrats. ### The idea that Ross wants to add the citizenship question to the census to help enforce the Voting Rights Act is a farce, which every court to rule on this issue has recognized. ### In other words, the conservative wing of the court has shown no concern about the Voting Rights Act. And the idea that Ross wants to add the citizenship question to the census to help enforce the Voting Rights Act is a farce, which every court to rule on this issue has recognized. ### Three lower federal courts have ruled that the Department of Commerce can not add a citizenship question to the census, at least under these circumstances. They all agreed that Ross failed to put forward valid reasons for the addition of the question. ### The three lower courts were right. The Supreme Court appears ready to undermine its legitimacy by ignoring reality and context and overturning those decisions. ### If this sounds familiar, it is because the court did the same thing last year when it ruled to uphold President Donald Trump’s travel ban . Despite numerous statements by both candidate Trump and President Trump that the purpose of the ban was to bar Muslims from entering the country, the court ignored reality, ignored context, and just looked at the words on the page of Trump’s third try at implementing a travel ban. ### This is looking less and less like an ideological battle between conservative and liberal judges and more like a Supreme Court controlled by partisan politicians in robes. And the census ruling could prove it. ### Jessica Levinson ### Jessica Levinson is a professor at Loyola Law School, Los Angeles. Her work focuses on election law and governance issues, including campaign finance, campaign disclosure, ethics, voting rights, redistricting, ballot initiatives, term limits and the Supreme Court. She is the former president of the Los Angeles Ethics Commission. Levinson was appointed by the Los Angeles City Controller in 2013 to serve a five-year term."
4738,washingtonpost.com,2019-05-31T07:50:25-04:00,"Email Bio Follow ### May 30 at 2:44 PM ### To hear President Trump’s administration tell it, the 2020 Census needs to include a question about residents’ citizenship because it would aid enforcement of the Voting Rights Act. Few experts think that such a question is needed for that purpose, mind you, and few people think that’s the administration’s motivation. Nonetheless, the Supreme Court appears to be poised to determine that the question can remain on next year’s national survey, accepting the administration’s rationale. ### That likelihood will probably not be affected by the discovery of remarkable documents that kneecap the White House’s argument. On Thursday, we learned that a Republican consultant who had argued for such a question had done so explicitly because he understood that it would help his party politically. ### The Washington Post’s Tara Bahrampour explained the discovery: ### The evidence, found in the files of the prominent Republican redistricting strategist Thomas Hofeller after his death last August, reveal that Hofeller “played a significant role in orchestrating the addition of the citizenship question to the 2020 Decennial Census in order to create a structural electoral advantage for, in his own words, ‘Republicans and Non-Hispanic Whites,’” and that Trump administration officials purposely obscured Hofeller’s role in court proceedings, lawyers for plaintiffs challenging the question wrote in a letter to U.S. District Judge Jesse Furman. ### Hofeller had been evaluating Texas’s legislative districts and determined that narrowing the population that was considered for the purposes of districting to voting-age citizens would aid Republicans in the Lone Star State. In other words, instead of drawing district boundaries based on the population of the state, he advocated using a narrower pool of individuals that would effectively force Democratic districts to be drawn larger to include enough residents — reducing the number of districts in heavily Democratic areas. ### To effectively implement that plan, though, he needed better data about the number of citizens. Ergo: a question on the census. ### The question itself probably will have much the same effect on Democratic districts, some experts say. It is likely to dampen responses from largely Hispanic and immigrant communities, places that often vote more heavily Democratic. ### Limiting the considered population pool to adult citizens would sharply reduce the number of people included in federal and state districting efforts. On average, about a quarter of the residents of each state would no longer be included in the population used for such analysis. Census Bureau citizen estimates suggest that the percentage of residents excluded would range from a 35.8 percent drop in Texas to a 20.3 percent drop in Maine. ### (Philip Bump/The Washington Post) ### Why such a large difference? Because Texas has a much larger density of Hispanic residents. About 57 percent of those who would be excluded from Texas’s count are Hispanic, both because the Hispanic population in the United States tends to be younger than other groups and because the state has many Hispanic noncitizens. California would experience a similar drop. ### (Philip Bump/The Washington Post) ### The percentage of non-Hispanic whites that would be excluded nationally is 20.2 percent. The percentage of Hispanics? More than half, 51.1 percent. ### That lopsidedness is one reason the political effect in Texas would be uneven. ### Hispanics vote more consistently Democratic than do whites. Most of the congressional districts nationally in which a shift to counting only adult citizens would yield the largest drop are ones that Hillary Clinton won in 2016. Generally, that’s a function of the size of the Hispanic population in the district. ### Of Texas’s 36 districts, the 10 that would be most affected by a shift to counting only adult citizens backed Clinton. The 15 that would be affected the least by that change voted for Trump. ### (Philip Bump/The Washington Post) ### We can look at the political effects of this in another way. If this concept were expanded nationally to the extent that electoral votes were allocated solely on the basis of the adult citizen population in each state, the effect would be a decline of four votes in blue states — driven by a decline of five votes in California — and a gain of four in red states. That’s a swing of eight votes to the GOP. ### (Philip Bump/The Washington Post) ### Shifts like these were apparently the point of Hofeller’s work. He recognized that by identifying the number of citizens across the country, he and his party could advocate for a rules change that benefited Republicans politically. ### For understandable reasons, that’s not the message the Trump administration wanted to promote. ### Most Read Politics"
5289,wsj.com,2019-05-31T09:23:04-04:00,"jo.mcginty@wsj.com ### May 31, 2019 8:00 a.m. ET ### In June, the U.S. Supreme Court will decide whether the Trump administration can add a citizenship question to the decennial census. ### The plan is controversial because it could lead to an undercount of the number of people living in the country. ### The decennial population figures determine how many U.S. representatives each state receives, how... ### To Read the Full Story"
5906,click2houston.com,2019-05-31T06:25:16-04:00,"Challengers of census citizenship question cite new evidence ### Supreme Court to decide if question goes on forms ### By Ariane de Vogue, CNN Supreme Court Reporter ### Posted: 7:37 PM, May 30, 2019 ### Updated: 7:37 PM, May 30, 2019 ### Copyright 2019 CNN ### The Supreme Court ponders whether a citizenship question should be included on the 2020 census form. ### WASHINGTON, D.C. - Challengers to the Trump administration's decision to add a citizenship question to the 2020 census informed the Supreme Court on Thursday that they believe they have ""new evidence"" that the move was politically motivated. ### They point to a newly disclosed 2015 study written by Dr. Thomas Hofeller, a Republican redistricting expert, who wrote that using ""citizen voting age"" population as the redistricting population base would be ""advantageous to Republicans and Non-Hispanic Whites."" ### Related stories ### John Roberts faces another test with census case ### The challengers, including groups such as the American Civil Liberties Union and Common Cause, say the new information shows Hofeller played a more significant role in the decision to add the citizenship question than has been disclosed and that his study reveals the true motive behind the administration's decision to add the question. ### Separately in a letter to District Judge Jesse M. Furman on Thursday, the challengers say the evidence bolsters their argument that while the administration contends the question was added to better comply with federal voting laws, the real reason was to intimidate Hispanic households from being counted. ### ""The new evidence thus not only contradicts testimony in this case, but it shows that those who constructed the VRA (Voting Rights Act) rationale knew that adding a citizenship question would not benefit Latino voters, but rather would facilitate significantly reducing their political power,"" the letter to the judge reads. ### The Justice Department called the challengers' allegations ""baseless,"" saying the consultant's study ""played no role"" in the decision. ### A department spokesperson said Thursday night: ""That study played no role in the Department's December 2017 request to reinstate a citizenship question to the 2020 decennial census. These unfounded allegations are an unfortunate last-ditch effort to derail the Supreme Court's consideration of this case. The Department looks forward to responding in greater detail to these baseless accusations in its filing on Monday."" ### Hofeller died last August. ### Furman ruled against the administration in January, holding that Commerce Secretary William Ross' decision to add the question was unlawful for a ""multitude of independent reasons"" and must be set aside. He said the decision to add the question violated the Administrative Procedure Act, a federal law that governs the way agencies can establish regulations. ### Most critically, Furman who sits on the US District Court for the Southern District of New York, said Ross' stated rationale for the question -- to promote the enforcement of the Voting Rights Act -- was ""pretextual -- in other words that he announced his decision in a manner that concealed its true basis."" ### The Supreme Court agreed to take up the appeal in an expedited time frame and heard arguments in April. In court, the conservative justices appeared ready to side with the government and allow the question. ### In the letter to Furman, the lawyers attached a copy of a deposition of A. Mark Neuman, who they say was Ross' expert adviser on the matter. ### He testified that Hofeller was the ""first person"" who suggested to him to add the citizenship question. Neuman said in the deposition that Hofeller had told him it would help maximize ""Latino representation."" ### ""But new evidence obtained in discovery in state court... shows that Dr. Hofeller instead knew that adding a citizenship question would have exactly the opposite effect—it would disadvantage Latinos and benefit ""Non-Hispanic Whites,"" the lawyers told the judge. ### They also say that Hofeller ""ghostwrote"" a ""substantial part"" of a draft letter that would ultimately become the Department of Justice's official letter requesting that Commerce add the citizenship question. ### ""This is important because it shows that Hofeller's work formed the basis for DOJ's request to add the citizenship question,"" said ACLU attorney Dale Ho. ### The information came to light after Hofeller had passed away and his estranged daughter collected his belongings. They included a hard drive which turned out to hold some 75,000 files. The interest group Common Cause was involved in a case concerning gerrymandering in North Carolina and subpoenaed the documents hoping to get a better understanding of Hofeller's work in that area. They then found the documents pertinent to their other case concerning the census case. ### Richard Hasen, of the University of California Irvine, called the new information ""blockbuster"" but he said he doubted the conservative justices on the Supreme Court would agree. He noted that during oral arguments they accepted at ""face value"" the administration's justification for the law, that the question was ""necessary to protect Hispanic voters."" ### The-CNN-Wire ™ & © 2019 Cable News Network, Inc., a Time Warner Company. All rights reserved."
6146,washingtonpost.com,2019-05-31T18:20:17-04:00,"May 31 at 3:41 PM ### This week, the hood came off. ### The Trump administration has devised a fundamentally racist policy : adding a question to the 2020 Census that will suppress participation by nonwhite people and, therefore, artificially increase white (and Republican) power in a new round of gerrymandering. ### To do this, administration officials falsely told the public, the lower courts and the Supreme Court that the disadvantage to nonwhite Americans was statistically questionable and that the Justice Department needed the change to enforce the Voting Rights Act . ### But documents released this week prove this all to be a ruse. Officials lied about their motives. ### The documents, from the files of the late architect of the plan, show that this gerrymandering expert (Thomas Hofeller, whose role the Trump administration did not disclose to the courts) authored a 2015 study saying his scheme (to use voting-age citizens for redistricting rather than total population) would require a “radical redrawing” of legislative districts that would “be advantageous to Republicans and Non-Hispanic Whites.” This “would clearly be a disadvantage for the Democrats,” he wrote , packing Democratic voters into fewer districts and “strengthening the adjoining GOP districts.” ### He warned that Latino voters would perceive it as “an attempt to diminish their voting strength.” Hofeller proposed laundering the idea by having the Justice Department claim it needed the citizenship question for voting-rights enforcement, and he wrote the framework of the request that the department eventually sent. ### The Trump administration’s top lawyer, Solicitor General Noel Francisco, told the Supreme Court in April that voting-rights enforcement was “ the principal benefit ” of the proposed change. That was false. The “principal benefit,” we now see, is to increase white power. In my column about the Supreme Court argument in April , I wrote that “it is difficult not to be cynical” about the administration’s true motive. Now, the racist policy is spelled out in black and white. ### This is shocking but not surprising. We tend not to realize how much of the president’s appeal is about race. Studies show the primary indicator of support for Trump isn’t economic insecurity but racial resentment . This doesn’t mean Trump supporters are torch-carrying racists; it means they fear losing their place. Racial tension has fueled our tribal partisanship, as party becomes a proxy for race and racial views. ### This is largely why the daily mayhem of the Trump presidency has no discernible effect on support for Trump: not the petty (the White House ordering John McCain’s name covered on a Navy ship); not the ludicrous (the Energy Department rebranding liquid natural gas “molecules of freedom”); not the insidious (Trump continuing to allege a “Russian hoax” and his own innocence after special counsel Robert Mueller demonstrated otherwise); not the ugly (Trump resisting disaster aid for Puerto Rico for months, and GOP lawmakers this week blocking the legislation ); and not the inhuman (migrant children held illegally, and dying, at the border). All of this pales against the existential threat to traditional white America from what it perceives as nonwhite interlopers. ### Some version of this has always been with us. “The very idea of being American has from the start been defined negatively by who could be classified as not-American,” writes my friend Eric Liu in his important new book, “ Become America ,” a collection of “civic sermons.” In the 18th and 19th centuries, the right to vote “was about earning a badge that a black person (and, for a long stretch, a Chinese person) could never earn: the badge of citizen, first-class.” Now we see a new variant, with Latinos and Muslims. ### People assume Trump’s “Make America Great Again” notion is about a return to the halcyon 1950s. “But it turns out we had the decade wrong,” Liu writes. “It was in the 1920s — after mass immigration from Southern and Eastern Europe. . . . that the [Ku Klux] Klan came back strong, that nativists took over the United States government, and that a nakedly racist system of immigration quotas and exclusion became the law.” ### The difference now is that, in as soon as a quarter century, white Americans will no longer be the majority . This needn’t be a loss for white people — immigration isn’t zero-sum — but Trump’s GOP has convinced followers it is. Therefore, preserving white power becomes essential, and the citizenship question buys time. ### It is a fundamentally dishonest undertaking, as we saw this week. Francisco, the solicitor general, had told the Supreme Court that “the Department of Justice’s letter is the one that articulated the Voting Rights Act rationale” of the new policy. We now know the Justice Department letter was ghostwritten by an expert who made the citizenship question the linchpin of a well-researched scheme to increase white voting power. ### The Supreme Court has a few weeks left to decide whether to endorse the Trump administration’s lie in the service of racism."
