id,publisher,scrape_time,text
604,slate.com,2019-05-31T17:45:53-04:00,"Why Do Children Keep Dying in U.S. Custody? Maybe Because Nobody Is Holding CBP Accountable. ### In February, attorneys challenging North Carolina’s legislative gerrymander notified the defendants, a group of Republican leaders in the legislature, that they’d issued a subpoena. The lawyers had asked Stephanie Hofeller Lizon to provide “any storage device” containing redistricting-related documents left by her estranged father, Thomas Hofeller, a Republican consultant who specialized in gerrymandering. Republican legislators did not object, and Lizon turned over the requested materials: 18 thumb drives and four hard drives containing more than 75,000 files—many related to her father’s consulting work. The voting rights attorneys had uncovered a vast trove of information exposing the inner workings of GOP gerrymandering across the country. ### Upon learning what their opponents had obtained, attorneys for Republican lawmakers went to court to try to seize the files. But it was too late. Voting rights advocates had lawfully acquired the materials, even after having given Republicans a chance to object. And on Thursday, they dropped the first bombshell from Hofeller’s hard drives: A key portion of a 2015 memo written by Hofeller appeared in a draft Justice Department letter used to justify the Trump administration’s efforts to add a citizenship question to the census. Hofeller’s memo, which explains why the citizenship question would boost the voting power of “Republicans and non-Hispanic Whites,” indicates that administration officials lied about the reason for adding the question. ### There are sure to be more revelations from the Hofeller files to come, driving home the downside of using a single consultant to mastermind redistricting across multiple states and decades. ### There are sure to be more revelations from the Hofeller files to come. ### For years, Hofeller held an office at the Republican National Committee on Capitol Hill. He worked as both its official redistricting director and, later, as a paid consultant. He traveled the country to teach Republican lawmakers how to gerrymander their districts to create permanent GOP legislative majorities. (Ironically, he incorporated warnings about keeping all of this work under wraps, like “Make sure your security is real,” “Make sure your computer is in a PRIVATE location,” and “The ‘e’ in email stands for ‘eternal.’ ”) Hofeller also personally helped to draw some of the country’s most egregiously gerrymandered maps, including those in Alabama, Pennsylvania, Texas, and Virginia. (He likely had a hand in more maps than we currently know.) But Hofeller devoted the most time to North Carolina, where he created lopsided Republican majorities in a state evenly divided between the parties. ### Following the 2010 red wave, Hofeller worked with the RNC to develop Project REDMAP , a sweeping initiative to help GOP-controlled state houses build durable gerrymanders. He taught lawmakers how to use racial and partisan data to dilute Democratic votes. His maps preserved Republicans’ House majority over the next three elections and maintained GOP domination over most state legislatures. ### Now Hofeller’s records are in the hands of attorneys for Common Cause, the voting rights group suing to invalidate North Carolina’s Hofeller-designed legislative gerrymander. The firm representing Common Cause, Arnold & Porter, also represents plaintiffs fighting the citizenship question—which is how Hofeller’s white voting power memo wound up before the judge overseeing the census case. (On Thursday, the American Civil Liberties Union also brought it to the Supreme Court’s attention.) ### The voting rights advocates in possession of the Hofeller collection have not yet revealed the full extent of the files. This may be because they have been exceedingly careful to play by the rules: Lizon offered her father’s drives to Common Cause directly, but its attorneys decided to issue a subpoena in February to obtain them formally and provide notice to third parties. ### Phil Strach, attorney for the Republican legislators in the North Carolina case, did not object to that subpoena at the time that notice was provided. At a hearing in April weeks after declining to challenge the subpoena, however, Strach attempted to block Common Cause’s attorneys from viewing the records they already had in their lawful possession. As Melissa Boughton reported at the time , Strach told Wake County Superior Court that he wanted the documents returned to Hofeller’s estate and implied that Lizon procured them improperly. Hofeller’s widow, Kathleen, expressly permitted Lizon to take the materials—but Strach claimed that Kathleen has been institutionalized and may not have been sufficiently competent to provide consent. (Stanton Jones, an Arnold & Porter attorney representing Common Cause, told the court that Kathleen has not been declared incompetent.) The court ignored Strach’s pleas, instead simply directing Common Cause’s attorneys to let the Republican defendants copy the Hofeller drives, pursuant to state law. ### Strach is not done fighting, though. At the April hearing, he said he believed the drives contain “Hofeller’s privileged work from many, many states over years and years.” He suggested that the files probably include “attorney client workload products” that may be privileged. It seems Republicans will attempt to limit voting rights advocates’ ability to use the Hofeller materials by raising a slew of objections. ### But Hofeller was not an attorney, and the vast majority of his files are unlikely to be privileged. While Arnold & Porter and Common Cause have been, as noted, exceedingly careful not to overstep any legal bounds, they almost certainly have every right to examine Hofeller’s materials and use them in litigation. And if Strach is correct that drives encompass work “from many, many states over years and years,” progressives will have hit a gold mine. Racial gerrymandering is generally illegal , and Hofeller’s work might include smoking guns proving that maps relied on impermissible racial data. Moreover, while the U.S. Supreme Court has not yet outlawed partisan gerrymandering, state Supreme Courts , including North Carolina’s, are moving in that direction . Hofeller’s files may contain more proof that legislators drew districts along partisan lines. ### In July, attorneys for Common Cause and North Carolina Republicans will face off at a trial over Hofeller’s partisan gerrymander of the state’s legislative districts. Voting rights attorneys will now likely be armed with data from Hofeller’s own hard drives, ready to pierce the secrecy of GOP redistricting. It will not be the last time the consultant’s materials are used to tear down the gerrymanders he spent his life perfecting. "
610,nbcnews.com,2019-05-31T20:00:35-04:00,"May 31, 2019, 9:52 PM UTC ### By Jessica Levinson, professor at Loyola Law School ### The Supreme Court is about to start looking a lot more like a political branch. Indeed, in a decade or less, we may look back at this time as the era in which the court lost any imprimatur of judicial independence. ### The court’s upcoming decision as to whether the Department of Commerce can add a question about citizenship to our national census will provide us with some important tea leaves for determining whether the current court is becoming the handmaiden of conservative politicians. The court is expected to rule by the end of June. ### New evidence suggests that Secretary of Commerce Wilbur Ross’ decision to add a citizenship question to the census had everything to do with helping Republicans and harming Democrats. These revelations mostly confirm what many observers had long suspected about the true motivations of the Commerce Department. What is more surprising — and revealing — is the fact that none of this is likely to matter to the Supreme Court. ### These revelations mostly confirm what many observers had long suspected. What is more shocking is the fact that none of this is likely to matter to the Supreme Court. ### The legal issues of the case may sound mundane, but the political stakes are huge. The U.S. Constitution says that Congress must count how many people live in our country. The census, conducted by the Department of Commerce, determines the number of representatives in the House, the distribution of electors in the Electoral College, and the amount of federal funding each state gets. While the commerce secretary is in charge of the census, he or she cannot engage in activities that are arbitrary and capricious. And yet, that is just what Secretary Wilbur Ross has done. ### In 2017, Ross disingenuously claimed that the Department of Justice had suggested that the Department of Commerce add a citizenship question to the census to help in enforcing the federal Voting Rights Act. But the idea to add the citizenship question appears not to have originated with the Department of Justice and has nothing to do with enforcing voters' rights. Meanwhile, many experts believe that adding a citizenship question to the census will lead people in immigrant-heavy areas, including legal and illegal immigrants, to not respond. This inaccuracy is why career experts in the Department of Commerce unanimously recommended that the citizenship question not be included. ### Smoking gun evidence of Trump's push to rig the census ### May 31, 201906:37 ### This is not a minor issue. The Census Department itself estimates that as many as 6.5 million people could not be counted as a result of adding the citizenship question. And it is not a coincidence that the majority of these 6.5 million people live in areas dominated by Democrats. In fact, we now know, that is in fact the whole point. ### Recently discovered documents on the computer of now-deceased Republican operative and redistricting expert Thomas Hofeller indicate that the idea to add the citizenship question actually originated with him, not the Department of Justice. His goal was not to help the Department of Justice enforce the Voting Rights Act, but rather to use this information to allow states to draw legislative district lines based not on the total population, but instead on the number of eligible voters. This would, he wrote, help “Republicans and non-Hispanic whites,” and would clearly hurt Democrats. ### The newly unearthed documents do not tell us more than what many already strongly suspected, but they do bring into stark relief why the Trump administration is so determined to add the citizenship question, and how they have lied about it. ### During oral arguments in April , the conservative members of the court appeared ready to accept at face value the Department of Commerce’s assertion that the citizenship question will be added to help enforce the Voting Rights Act. It is worth remembering that the conservative wing of the court has not been particularly concerned about the Voting Rights Act in the past. In fact, just six years ago it struck down a key portion of the act designed to protect voters from discriminatory voting laws. ### Since that 2013 decision, states and localities throughout the nation have enacted laws burdening the right to vote . States have, for instance, reduced or eliminated early voting, reduced the number of voting centers, purged voter rolls, and implemented stringent voter identification requirements. This was an entirely predictable consequence of the court’s decision. ### More recently, a slim conservative majority of the court voted to uphold an Ohio law that took voters off the voter rolls if they failed to both vote in one election and respond to a postcard asking them to confirm their address. The court couched its language in the need to protect the integrity of the electoral process, but the truth is that Ohio’s law disproportionately affects the ability of poor and minority voters to vote. And again, not coincidentally, those people are disproportionately Democrats. ### The idea that Ross wants to add the citizenship question to the census to help enforce the Voting Rights Act is a farce, which every court to rule on this issue has recognized. ### In other words, the conservative wing of the court has shown no concern about the Voting Rights Act. And the idea that Ross wants to add the citizenship question to the census to help enforce the Voting Rights Act is a farce, which every court to rule on this issue has recognized. ### Three lower federal courts have ruled that the Department of Commerce can not add a citizenship question to the census, at least under these circumstances. They all agreed that Ross failed to put forward valid reasons for the addition of the question. ### The three lower courts were right. The Supreme Court appears ready to undermine its legitimacy by ignoring reality and context and overturning those decisions. ### If this sounds familiar, it is because the court did the same thing last year when it ruled to uphold President Donald Trump’s travel ban . Despite numerous statements by both candidate Trump and President Trump that the purpose of the ban was to bar Muslims from entering the country, the court ignored reality, ignored context, and just looked at the words on the page of Trump’s third try at implementing a travel ban. ### This is looking less and less like an ideological battle between conservative and liberal judges and more like a Supreme Court controlled by partisan politicians in robes. And the census ruling could prove it. ### Jessica Levinson ### Jessica Levinson is a professor at Loyola Law School, Los Angeles. Her work focuses on election law and governance issues, including campaign finance, campaign disclosure, ethics, voting rights, redistricting, ballot initiatives, term limits and the Supreme Court. She is the former president of the Los Angeles Ethics Commission. Levinson was appointed by the Los Angeles City Controller in 2013 to serve a five-year term."
761,yahoo.com/news,2019-05-31T07:38:26-04:00,"May 30, 2019 ### By Brendan Pierson ### NEW YORK (Reuters) - The Trump administration concealed evidence that its proposal to add a question about citizenship to the 2020 U.S. census was intended to help Republicans draw favorable electoral maps, according to immigrant advocacy groups that sued the administration over the question last year. ### In a filing in Manhattan federal court on Thursday, the groups said that the administration hid the fact during the course of the lawsuit that went to trial last year that Thomas Hofeller, a longtime Republican specialist on drawing electoral districts, played a ""significant role"" in planning the citizenship question. ### The conservative-majority Supreme Court is due to issue a final ruling by the end of June on whether the question can be added in time for next year's census. ### The challengers notified the high court about the new documents in a letter filed at the court on Thursday afternoon. They did not ask the Supreme Court to take any specific action. ### The plaintiffs, which include the Arab-American Anti-Discrimination Committee and Make The Road New York, learned of Hofeller's role after his files came to light in separate litigation in North Carolina in which Republican-drawn electoral districts are being challenged. ### A Justice Department representative said the allegations were a ""last-ditch effort to derail the Supreme Court’s consideration of this case."" ### ""The Department looks forward to responding in greater detail to these baseless accusations in its filing on Monday,” the person said. ### Manhattan-based U.S. District Judge Jesse Furman blocked the question's inclusion following the trial, but the Supreme Court appeared poised to overturn that ruling at April's oral argument. ### According to Thursday's filing, Hofeller concluded in a 2015 study that asking census respondents whether they are U.S. citizens ""would clearly be a disadvantage to the Democrats"" and ""advantageous to Republicans and Non-Hispanic Whites"" in redistricting. ### Hofeller went on to ghostwrite a draft letter from the U.S. Department of Justice to the Department of Commerce, asking for a citizenship question on the grounds it would help enforce voting rights, according to the plaintiffs. ### The plaintiffs, represented by the American Civil Liberties Union, said that administration officials gave false testimony about the origin of the question during the lawsuit, and have asked Furman to consider imposing unspecified sanctions against them. ### Furman has scheduled a hearing on the request for June 5. ### Reuters reported in April that the Trump administration believed its citizenship question could help Republicans in elections by enabling states to draw electoral maps based only on citizen population, rather than total population. ### Opponents have said a citizenship question would cause a sizeable undercount by deterring immigrant households and Latinos from filling out the census forms, out of fear the information would be shared with law enforcement. That would, they argue, cost Democratic-leaning areas electoral representation in Congress and federal aid, benefiting President Donald Trump’s fellow Republicans and Republican-leaning parts of the country. ### (Reporting by Brendan Pierson and Andrew Chung in New York; Additional reporting by Lawrence Hurley in Washington; Editing by Steve Orlofsky, Tom Brown and Lisa Shumaker) ### What to Read Next"
